obligation_delegation_id,obligation_id,responsibility_id,responsibility_family_id,obligation_statement,obligation_type,primary_enforcing_entity_ids,primary_enforcing_entity_names,supporting_entity_ids,supporting_entity_names,governed_object_ids,governed_object_names,enablement_family_ids,enablement_family_names,surface_ids,surface_names,contract_trace_ids,gap_trace_ids,doctrine_trace_ids,anti_collapse_rule,notes
OBLDEL-042,OBL-CAN-042,RSP-CAN-042,RSP-FAM-008,"Slot lifecycle must support release, readiness, and requalification.","slot_lifecycle","E-INT-006","Single Queue Moderator","E-INT-004","Dispatching / Delivery Round Manager","BCO-008;BCO-006;BCO-011","Slot Lifecycle State;Slot;Queue Container Identifier","EN-FAM-004","Queue Runtime Enablement","SURF-MANAGERIAL","Managerial","CC-STATE-004;CC-STATE-008","G-005;G-006","DOC-007","Slot lifecycle is local runtime state, not registry-side envelope lifecycle.","Slot lifecycle state enables later waiting-list discipline."
OBLDEL-043,OBL-CAN-043,RSP-CAN-043,RSP-FAM-008,"Post-delivery completion must restore waiting discipline where required.","waiting_discipline_restoration","E-INT-006","Single Queue Moderator","E-INT-004;E-INT-005","Dispatching / Delivery Round Manager;Queue Bundle Agent","BCO-008;BCO-010;BCO-011","Slot Lifecycle State;Delivery Round Waiting List;Queue Container Identifier","EN-FAM-004","Queue Runtime Enablement","SURF-MANAGERIAL","Managerial","CC-STATE-005;CC-STATE-007;CC-STATE-008","G-005;G-006","DOC-007","Post-delivery completion must not leave queue-container identifiers stranded.","Restores delivery-side waiting discipline."
OBLDEL-044,OBL-CAN-044,RSP-CAN-044,RSP-FAM-008,"Writing waiting list must store queue-container identifiers, not envelopes.","waiting_list_locator","E-INT-003","Writing / Feeding Round Manager","E-INT-005","Queue Bundle Agent","BCO-009;BCO-011","Writing Round Waiting List;Queue Container Identifier","EN-FAM-004","Queue Runtime Enablement","SURF-MANAGERIAL","Managerial","CC-STATE-006;CC-STATE-008","G-005;G-006","DOC-007","Writing waiting list must not store Log Level Envelopes.","Waiting list stores locators to queue-containers."
OBLDEL-045,OBL-CAN-045,RSP-CAN-045,RSP-FAM-008,"Delivery waiting list must store queue-container identifiers, not envelopes.","waiting_list_locator","E-INT-004","Dispatching / Delivery Round Manager","E-INT-006;E-INT-005","Single Queue Moderator;Queue Bundle Agent","BCO-010;BCO-011","Delivery Round Waiting List;Queue Container Identifier","EN-FAM-004","Queue Runtime Enablement","SURF-MANAGERIAL","Managerial","CC-STATE-007;CC-STATE-008","G-005;G-006","DOC-007","Delivery waiting list must not store Log Level Envelopes.","Delivery waiting list stores locators to queue-containers."
OBLDEL-046,OBL-CAN-046,RSP-CAN-046,RSP-FAM-008,"Queue Container Identifier must locate queue-container only.","locator_semantics","E-INT-003;E-INT-004","Writing / Feeding Round Manager;Dispatching / Delivery Round Manager","E-INT-005;E-INT-006","Queue Bundle Agent;Single Queue Moderator","BCO-011;BCO-005","Queue Container Identifier;Queue Container","EN-FAM-004","Queue Runtime Enablement","SURF-MANAGERIAL","Managerial","CC-STATE-008","G-005;G-006","DOC-007","Queue Container Identifier must not be treated as envelope identity.","Locator semantics remain queue-container-specific."
OBLDEL-047,OBL-CAN-047,RSP-CAN-047,RSP-FAM-008,"Requalified queue-container IDs must return to the correct waiting list.","requalification_routing","E-INT-006","Single Queue Moderator","E-INT-004;E-INT-003","Dispatching / Delivery Round Manager;Writing / Feeding Round Manager","BCO-011;BCO-008;BCO-010;BCO-009","Queue Container Identifier;Slot Lifecycle State;Delivery Round Waiting List;Writing Round Waiting List","EN-FAM-004","Queue Runtime Enablement","SURF-MANAGERIAL","Managerial","CC-STATE-005;CC-STATE-006;CC-STATE-007;CC-STATE-008","G-005;G-006","DOC-007","Requalified ID must not be routed to the wrong round discipline.","Preserves writing/delivery waiting-list discipline."
OBLDEL-048,OBL-CAN-048,RSP-CAN-048,RSP-FAM-008,"Detailed feedback reports must remain separate diagnostic/reporting artifacts.","diagnostic_report_separation","E-INT-002","Dispatcher","E-INT-004;E-INT-006;OPTIONAL-DIAGNOSTIC-CONSUMER","Dispatching / Delivery Round Manager;Single Queue Moderator;Optional diagnostics/reporting consumer","BCO-014","Dispatcher Feedback Report","EN-FAM-006","Feedback / Reporting Enablement","SURF-MANAGERIAL;SURF-OBSERVABILITY","Managerial;Observability","CC-REG-002;CT-FAM-005","G-003","DOC-001","Dispatcher Feedback Report must not be treated as Delivery-Cycle Flag Set.","Expanded in 04.04 into five detailed report sub-responsibilities."
OBLDEL-049,OBL-CAN-049,RSP-CAN-049,RSP-FAM-008,"Ownership and occupancy language must not introduce a separate runtime container.","terminology_guard","E-INT-006;E-INT-005","Single Queue Moderator;Queue Bundle Agent","E-INT-003;E-INT-004","Writing / Feeding Round Manager;Dispatching / Delivery Round Manager","BCO-005;BCO-007;BCO-012;BCO-011","Queue Container;Envelope Slot Occupancy;Log Level Envelope;Queue Container Identifier","EN-FAM-004;EN-FAM-007","Queue Runtime Enablement;Boundary / Exclusion Enablement","SURF-MANAGERIAL;SURF-BOUNDARY","Managerial;Boundary","CC-STATE-002;CC-STATE-003;CC-STATE-008","G-006","DOC-006;DOC-007","Queue equals Container; occupancy is binding/state; envelope lifecycle is separate.","Terminology guard preserves the corrected queue-container model."